Researcher,Year,Title,Type,Abstract,Source,Authors,Institution,Topics,Affiliation Match
Federica Amici,2020,Innovation in wild Barbary macaques (Macaca sylvanus),article,"Innovation is the ability to solve novel problems or find novel solutions to familiar problems, and it is known to affect fitness in both human and non-human animals. In primates, innovation has been mostly studied in captivity, although differences in living conditions may affect individuals’ ability to innovate. Here, we tested innovation in a wild group of Barbary macaques ( Macaca sylvanus ). In four different conditions, we presented the group with several identical foraging boxes containing food. To understand which individual characteristics and behavioural strategies best predicted innovation rate, we measured the identity of the individuals manipulating the boxes and retrieving the food, and their behaviour during the task. Our results showed that success in the novel task was mainly affected by the experimental contingencies and the behavioural strategies used during the task. Individuals were more successful in the 1-step conditions, if they participated in more trials, showed little latency to approach the boxes and mainly manipulated functional parts of the box. In contrast, we found no effect of inhibition, social facilitation and individual characteristics like sex, age, rank, centrality, neophobia and reaction to humans, on the individuals’ ability to innovate.","<a href=""https://openalex.org/W3012090232"" target=""_blank"">OpenAlex</a>","Federica Amici, Álvaro L. Caicoya, Bonaventura Majolo, Anja Widdig","University of Lincoln, Universitat de Barcelona, Max Planck Institute for Evolutionary Anthropology, Leipzig University",Primate Behavior and Ecology,University of Leipzig
Federica Amici,2020,Gaze Following in Ungulates: Domesticated and Non-domesticated Species Follow the Gaze of Both Humans and Conspecifics in an Experimental Context,article,"Gaze following is the ability to use others’ gaze to obtain information about the environment (e.g., food location, predators, and social interactions). As such, it may be highly adaptive in a variety of socio-ecological contexts, and thus be widespread across animal taxa. To date, gaze following has been mostly studied in primates, and partially in birds, but little is known on the gaze following abilities of other taxa and, especially, on the evolutionary pressures that led to their emergence. In this study, we used an experimental approach to test gaze following skills in a still understudied taxon, ungulates. Across four species (i.e., domestic goats and lamas, and non-domestic guanacos and mouflons), we assessed the individual ability to spontaneously follow the gaze of both conspecifics and human experimenters in different conditions. In line with our predictions, species followed the model’s gaze both with human and conspecific models, but more likely with the latter. Except for guanacos, all species showed gaze following significantly more in the experimental conditions (than in the control ones). Despite the relative low number of study subjects, our study provides the first experimental evidence of gaze following skills in non-domesticated ungulates, and contributes to understanding how gaze following skills are distributed in another taxon—an essential endeavor to identify the evolutionary pressures leading to the emergence of gaze following skills across taxa.","<a href=""https://openalex.org/W3104880496"" target=""_blank"">OpenAlex</a>","Alina Schaffer, Álvaro L. Caicoya, Montserrat Colell, Ruben Holland, Conrad Ensenyat, Federica Amici","Max Planck Institute for Evolutionary Anthropology, Universitat de Barcelona, Leipzig University",Human-Animal Interaction Studies,University of Leipzig
Federica Amici,2021,Invasive Research on Non-Human Primates—Time to Turn the Page,article,"Invasive research on primates (i.e., laboratory research that implies body manipulations causing pain or distress that is not aimed to directly improve the individuals' well-being) has a long history. Although some invasive studies have allowed answering research questions that we could not have addressed with other methods (or at least not as quickly), the use of primates in invasive research also raises ethical concerns. In this review, we will discuss (i) recent advances in the study of primates that show evidence of complex behaviour and cognition, (ii) welfare issues that might arise when using primates in invasive research, (iii) the main ethical issues that have been raised about invasive research on primates, (iv) the legal protection that primates are granted in several countries, with a special focus on the principle of the 3Rs, and (v) previous and current attempts to ban the use of primates in invasive research. Based on this analysis, we suggest that the importance of a research question cannot justify the costs of invasive research on primates, and that non-invasive methods should be considered the only possible approach in the study of primates.","<a href=""https://openalex.org/W3207156126"" target=""_blank"">OpenAlex</a>","Maria Padrell, Miquel Llorente, Federica Amici","University of Girona, Max Planck Institute for Evolutionary Anthropology, Leipzig University",Primate Behavior and Ecology,University of Leipzig
Federica Amici,2024,"Evidence of object permanence, short-term spatial memory, causality, understanding of object properties and gravity across five different ungulate species",article,"In their natural environment, animals face a variety of ecological and social challenges, which might be linked to the emergence of different cognitive skills. To assess inter-specific variation in cognitive skills, we used ungulates as a study model, testing a total of 26 captive individuals across 5 different species (i.e., dwarf goats, Capra aegagrus hircus , llamas, Lama glama , guanacos, Lama guanicoe , zebras, Equus grevyi , and rhinos, Diceros bicornis michaeli ). Across species, we used the same well-established experimental procedures to test individuals’ performance in naïve physics tasks, i.e. object permanence, short-term spatial memory, causality, understanding of object properties, and gravity. Our results revealed that study subjects showed object permanence, were able to remember the position of hidden food after up to 60 s, and inferred the position of hidden food from the sound produced or not produced when shaking containers. Moreover, they showed an understanding of basic object properties, being able to locate objects hidden behind occluders based on their size and inclination, and could reliably follow the trajectory of falling objects across different conditions. Finally, inter-specific differences were limited to the understanding of object properties, and suggest that domesticated species as goats might perform better than non-domesticated ones in tasks requiring these skills. These results provide new information on the cognitive skills of a still understudied taxon and confirm ungulates as a promising taxon for the comparative study of cognitive evolution.","<a href=""https://openalex.org/W4399686962"" target=""_blank"">OpenAlex</a>","Alina Schaffer, Anja Widdig, Ruben Holland, Federica Amici",Leipzig University,Human-Animal Interaction Studies,University of Leipzig
Federica Amici,2020,Dominance style only partially predicts differences in neophobia and social tolerance over food in four macaque species,article,"Primates live in complex social systems with social structures ranging from more to less despotic. In less despotic species, dominance might impose fewer constraints on social choices, tolerance is greater than in despotic species and subordinates may have little need to include novel food items in the diet (i.e. neophilia), as contest food competition is lower and resources more equally distributed across group members. Here, we used macaques as a model to assess whether different dominance styles predict differences in neophilia and social tolerance over food. We provided familiar and novel food to 4 groups of wild macaques (N = 131) with different dominance styles ( Macaca fuscata , M. fascicularis , M. sylvanus , M. maura ). Our study revealed inter- and intra-specific differences in individuals’ access to food, which only partially reflected the dominance styles of the study subjects. Contrary to our prediction, social tolerance over food was higher in more despotic species than in less despotic species. Individuals with a higher dominance rank and being better socially integrated (i.e. higher Eigenvector centrality) were more likely to retrieve food in all species, regardless of their dominance style. Partially in line with our predictions, less integrated individuals more likely overcame neophobia (as compared to more integrated ones), but only in species with more tolerance over food. Our study suggests that individual characteristics (e.g. social integration or personality) other than dominance rank may have a stronger effect on an individual’s access to resources.","<a href=""https://openalex.org/W3110696620"" target=""_blank"">OpenAlex</a>","Federica Amici, Anja Widdig, Andrew J. J. MacIntosh, Víctor Beltrán Francés, Alba Castellano‐Navarro, Álvaro L. Caicoya, Karimullah Karimullah, Risma Illa Maulany, Putu Oka Ngakan, Andi Siady Hamzah, Bonaventura Majolo","University of Girona, Hasanuddin University, Kyoto University, Universitat de Barcelona, Universidad Cardenal Herrera CEU, Universiti Sains Malaysia, University of Lincoln, Leipzig University",Primate Behavior and Ecology,University of Leipzig
Federica Amici,2022,The Habituation Process in Two Groups of Wild Moor Macaques (Macaca maura),article,"When studying animal behavior in the wild, some behaviors may require observation from a relatively short distance. In these cases, habituation is commonly used to ensure that animals do not perceive researchers as a direct threat and do not alter their behavior in their presence. However, habituation can have significant effects on the welfare and conservation of the animals. Studying how nonhuman primates react to the process of habituation can help to identify the factors that affect habituation and implement habituation protocols that allow other researchers to speed up the process while maintaining high standards of health and safety for both animals and researchers. In this study, we systematically described the habituation of two groups of wild moor macaques (Macaca maura), an Endangered endemic species of Sulawesi Island (Indonesia), to assess the factors that facilitate habituation and reduce impact on animal behavior during this process. During 7 months, we conducted behavioral observations for more than 7,872 encounters and an average of 120 days to monitor how macaque behavior toward researchers changed through time in the two groups under different conditions. We found that both study groups (N = 56, N = 41) became more tolerant to the presence of researchers during the course of the habituation, with occurrence of neutral group responses increasing, and minimum distance to researchers and occurrence of fearful group responses decreasing through time. These changes in behavior were predominant when macaques were in trees, with better visibility conditions, when researchers maintained a longer minimum distance to macaques and, unexpectedly, by the presence of more than one researcher. By identifying these factors, we contribute to designing habituation protocols that decrease the likelihood of fearful responses and might reduce the stress experienced during this process.","<a href=""https://openalex.org/W4205893101"" target=""_blank"">OpenAlex</a>","Clara Hernández Tienda, Bonaventura Majolo, Teresa Romero, Risma Illa Maulany, Putu Oka Ngakan, Víctor Beltrán Francés, Elisa Gregorio Hernández, José Gómez-Melara, Miquel Llorente, Federica Amici","University of Girona, Hasanuddin University, Max Planck Institute for Evolutionary Anthropology, Universidad de Sevilla, University of Lincoln",Primate Behavior and Ecology,University of Leipzig
Federica Amici,2022,"Maternal stress, child behavior and the promotive role of older siblings",article,"Background In the first years of their lives, children develop the cognitive, social and emotional skills that will provide the foundations for their lifelong health and achievements. To increase their life prospects and reduce the long-term effects of early aversive conditions, it is therefore crucial to understand the risk factors that negatively affect child development and the factors that are instead beneficial. In this study, we tested (i) the effects of different social and environmental stressors on maternal stress levels, (ii) the dynamic relationship between maternal stress and child behavior problems during development, and (iii) the potential promotive (i.e. main) or protective (i.e. buffering) effect of siblings on child behavior problems during development. Methods We used longitudinal data from 373 mother–child pairs (188 daughters, 185 sons) from pregnancy until 10 years of age. We assessed maternal stress and child behavior problems (internalizing and externalizing) with validated questionnaires, and then used linear mixed models, generalized linear mixed models and longitudinal cross-lagged models to analyze the data. Results Our results showed that higher maternal stress levels were predicted by socio-environmental stressors (i.e. the lack of sufficient social areas in the neighborhood). Moreover, prenatal maternal stress reliably predicted the occurrence of behavior problems during childhood. Finally, the presence of older siblings had a promotive function, by reducing the likelihood that children developed externalizing problems. Conclusions Overall, our results confirm the negative effects that maternal stress during pregnancy may have on the offspring, and suggest an important main effect of older siblings in promoting a positive child development.","<a href=""https://openalex.org/W4225147737"" target=""_blank"">OpenAlex</a>","Federica Amici, Stefan Röder, Wieland Kieß, Michael Borte, Ana Claudia Zenclussen, Anja Widdig, Gunda Herberth","Klinikum St. Georg, Max Planck Institute for Evolutionary Anthropology, Leipzig University, Helmholtz Centre for Environmental Research",Maternal Mental Health During Pregnancy and Postpartum,University of Leipzig
Federica Amici,2023,Face to face interactions in chimpanzee ( <i>Pan troglodytes</i> ) and human ( <i>Homo sapiens</i> ) mother–infant dyads,article,"Human mothers interact with their infants in different ways. In Western, educated, industrialized, rich and democratic (WEIRD) societies, face-to-face interactions and mutual gazes are especially frequent, yet little is known about their developmental trajectories and if they differ from those of other primates. Using a cross-species developmental approach, we compared mother–infant interactions in 10 dyads of urban humans from a WEIRD society ( Homo sapiens ) and 10 dyads of captive zoo-based chimpanzees ( Pan troglodytes ), when infants were one, six and 12 months old. Results showed that face-to-face interactions with mutual gaze events were common in both groups throughout the infant's first year of life. The developmental trajectories of maternal and infants’ looks partially differed between species, but mutual gaze events were overall longer in humans than in chimpanzees. Mutual gazes were also more frequent in humans, peaking at six months in humans, while increasing with age in chimpanzees. The duration and frequency of mutual gazes varied across contexts in both groups, with mutual gazes being longer during caring/grooming and feeding contexts. These findings confirm that some aspects of early socio-cognitive development are shared by humans and other primates, and highlight the importance of combining developmental and cross-species approaches to better understand the evolutionary roots of parenting behaviour. This article is part of a discussion meeting issue ‘Face2face: advancing the science of social interaction’.","<a href=""https://openalex.org/W4323257211"" target=""_blank"">OpenAlex</a>","Federica Amici, Manuela Ersson-Lembeck, Manfred Holodynski, Katja Liebal","Freie Universität Berlin, Max Planck Institute for Evolutionary Anthropology, Leipzig University, University of Münster",Child and Animal Learning Development,University of Leipzig
Federica Amici,2023,Giraffes make decisions based on statistical information,article,"The ability to make inferences based on statistical information has so far been tested only in animals having large brains in relation to their body size, like primates and parrots. Here we tested if giraffes (Giraffa camelopardalis), despite having a smaller relative brain size, can rely on relative frequencies to predict sampling outcomes. We presented them with two transparent containers filled with different quantities of highly-liked food and less-preferred food. The experimenter covertly drew one piece of food from each container, and let the giraffe choose between the two options. In the first task, we varied the quantity and relative frequency of highly-liked and less-preferred food pieces. In the second task, we inserted a physical barrier in both containers, so giraffes only had to take into account the upper part of the container when predicting the outcome. In both tasks giraffes successfully selected the container more likely to provide the highly-liked food, integrating physical information to correctly predict sampling information. By ruling out alternative explanations based on simpler quantity heuristics and learning processes, we showed that giraffes can make decisions based on statistical inferences.","<a href=""https://openalex.org/W4372335605"" target=""_blank"">OpenAlex</a>","Álvaro L. Caicoya, Montserrat Colell, Federica Amici","Universitat de Barcelona, Leipzig University",Decision-Making and Behavioral Economics,University of Leipzig
Federica Amici,2021,Dominance style predicts differences in food retrieval strategies,article,"In several species, rank predicts access to food, and subordinates may need specific behavioural strategies to get a share of resources. This may be especially important in despotic species, where resources are strongly biased in favour of dominants and subordinates may more strongly rely on specific tactics to maximize food intake. Here, we compared three macaque species with an experimental set-up reproducing feeding competition contest. Following our predictions, more tolerant species mostly retrieved food in the presence of others and were less dependent on specific tactics. Contrarily, subordinates in more despotic species more likely collected food (1) when dominants could not see food or (2) were attacking others, (3) while ""dissimulating"", or (4) ""storing food"". Our study reveals that dominance styles reliably predict the probability of using specific food retrieval tactics and provides important insights on the social conditions that might have led to the emergence of tactical deception.","<a href=""https://openalex.org/W3128083243"" target=""_blank"">OpenAlex</a>","José Gómez-Melara, Rufino Acosta Naranjo, Alba Castellano‐Navarro, Víctor Beltrán Francés, Álvaro L. Caicoya, Andrew J. J. MacIntosh, Risma Illa Maulany, Putu Oka Ngakan, Federica Amici","University of Girona, Hasanuddin University, Kyoto University, Universitat de Barcelona, Universidad de Sevilla, Universidad Cardenal Herrera CEU, Leipzig University",Primate Behavior and Ecology,University of Leipzig
Federica Amici,2022,Understanding potential conflicts between human and non-human-primates: a large-scale survey in Malaysia,article,"With increasing anthropogenic pressure, interactions between humans and wildlife may become more frequent, including conflictual ones. To reduce conflicts, it is important to understand how different factors (e.g. education, previous experience, demographic variables) interplay with each other and contribute to the emergence of negative attitudes and behaviours toward wildlife in humans. To address this issue, we conducted a large-scale questionnaire in Malaysia, focusing on potential conflicts between human and other primates. We used generalized linear mixed models to assess how formal education, knowledge about primates, negative experience and potential competition affected participants’ negative attitudes to primates (i.e. how humans perceive primates), their behavioural intentions (i.e. opinion on how to reduce conflicts) and behaviour (i.e. measures taken to reduce negative interactions). We found that negative experience and potential competition had a negative impact on participants’ attitude and behavior (i.e. primates were more likely perceived as filthy, as negatively affecting residents’ health and safety, and as an increasing problem, with participants more likely to use invasive methods, including captures). Both higher education and better knowledge of primates predicted more positive behavioural intentions (i.e. primates should be protected, non-invasive interventions should be used). Higher education, however, was also linked to more negative attitudes (i.e. primates negatively affect residents’ health and safety), and partly to negative behavior (e.g. use of invasive methods). In contrast, better knowledge about primates predicted positive behaviour (i.e. exclusive use of non-invasive methods). Therefore, although better knowledge of primates had no clear effect on human attitudes, it may impact on their decisions to reduce potential conflicts with wildlife, and might be the most powerful tool to mitigate conflicts between humans and other species.","<a href=""https://openalex.org/W4214741524"" target=""_blank"">OpenAlex</a>","Karimullah Karimullah, Anja Widdig, Shahrul Anuar Mohd Sah, Federica Amici","Max Planck Institute for Evolutionary Anthropology, Universiti Sains Malaysia, German Centre for Integrative Biodiversity Research, Leipzig University",Primate Behavior and Ecology,University of Leipzig
Federica Amici,2023,A Roadmap for Technological Innovation in Multimodal Communication Research,book-chapter,Abstract not available,"<a href=""https://openalex.org/W4383755750"" target=""_blank"">OpenAlex</a>","Alina Gregori, Federica Amici, Ingmar Brilmayer, Aleksandra Ćwiek, L. Fritzsche, Susanne Fuchs, Alexander Henlein, Oliver Herbort, Frank Kügler, Jens Lemanski, Katja Liebal, Andy Lücking, Alexander Mehler, Kim Tien Nguyen, Wim Pouw, Pilar Prieto, Patrick Louis Rohrer, Paula G. Sánchez-Ramón, Martin Schulte‐Rüther, Petra B. Schumacher, Stefan R. Schweinberger, Volker Struckmeier, Patrick C. Trettenbrein, Celina I. von Eiff","University of Cologne, Max Planck Institute for Human Cognitive and Brain Sciences, Radboud University Nijmegen, Leibniz-Centre General Linguistics, Goethe University Frankfurt, Universitätsmedizin Göttingen, Friedrich Schiller University Jena, Leipzig University, Pompeu Fabra University, Institució Catalana de Recerca i Estudis Avançats, University of Würzburg",Hearing Impairment and Communication,University of Leipzig
Federica Amici,2020,Play behavior in immature moor macaques (<i>Macaca maura</i>) and Japanese macaques (<i>Macaca fuscata</i>),article,"Play is widespread across mammalian taxa, but species strongly vary in the ways they play. In less despotic primate species (i.e., with less steep dominance hierarchies, less severe conflicts, and more reconciliation), play has been described as being more frequent, cooperative, and freely expressed. To study the link between social play and dominance style, we compared play behavior in free‐ranging infants, juveniles and subadults of more despotic Japanese macaques ( Macaca fuscata, N = 24) and less despotic moor macaques ( Macaca maura, N = 17). We found interspecific differences in play behavior that corresponded with the contrasting dominance styles of the study species, largely confirming our predictions. In particular, moor macaques spent a larger proportion of time in solitary and social play than Japanese macaques, while Japanese macaques spent a larger proportion of time in grooming interactions. In moor macaques, play sessions included more players, a larger variety of play behaviors, greater play face rates, a greater proportion of time in contact play, and a higher rate of reciprocal play‐biting than in Japanese macaques. Aggressive escalations were not common, but more frequent in Japanese macaques. Finally, a higher frequency of play faces during play sessions predicted the occurrence of more reciprocal play‐bites, but not the proportion of time spent in contact play behaviors. Additional studies on other groups and species will allow a better understanding of the link between dominance style and social play.","<a href=""https://openalex.org/W3080548415"" target=""_blank"">OpenAlex</a>","Víctor Beltrán Francés, Alba Castellano‐Navarro, Risma Illa Maulany, Putu Oka Ngakan, Andrew J. J. MacIntosh, Miquel Llorente, Federica Amici","University of Girona, Hasanuddin University, Max Planck Institute for Evolutionary Anthropology, Kyoto University, Universidad Cardenal Herrera CEU, Leipzig University",Primate Behavior and Ecology,University of Leipzig
